{
    "handoff_id": "HO-20260211-001",
    "from_agent": "MANUS_MERCER",
    "to_agent": "CHATGPT_MERCER",
    "timestamp": "2026-02-11T00:15:00Z",
    "scope": "private",
    "summary": "Completed full SymbolOS v2.0 upgrade, including 12 rings, 7 memory types, and all 10 design proposals. Ready for Opus rewrite.",
    "decisions_made": [
        "Ring model expanded to R0-R11",
        "Memory system structured into M0-M6"
    ],
    "open_items": [
        "Integrate Opus rewrite",
        "Address Rhy Test compliance gaps"
    ],
    "context_files": [
        "memory/quest_threads/QT-003_12_Ring_Expansion.md",
        "scripts/run_rhy_test.py"
    ],
    "alignment_score": 95.0,
    "ring_state": {
        "R0": "updated",
        "R1": "stable",
        "R2": "stable",
        "R3": "stable",
        "R4": "updated",
        "R5": "stable",
        "R6": "updated",
        "R7": "updated",
        "R8": "updated",
        "R9": "stable",
        "R10": "updated",
        "R11": "stable"
    }
}
