{
  "handoff_id": "HO-20260211-004",
  "from_agent": "MANUS_MERCER",
  "to_agent": "ALL",
  "timestamp": "2026-02-11T23:00:00Z",
  "scope": "public",
  "summary": "Completed 4 working_set tasks: agent handoff payload schema, token_ledger.py, compute_router.py, blob emoji system (manifest + React component). Updated memory_record and precog_card schemas to v2. All tested and ready for integration.",
  "decisions_made": [
    "Handoff payload schema extends existing handoff.schema.json (backward compatible)",
    "Token ledger uses JSONL at memory/m0_episodic/token_ledger.jsonl per local_llama_design_v1 spec",
    "Compute router defaults T0 (local), escalates on ring/size/pattern constraints",
    "Blob emoji uses C1710/blobmoji CDN via jsDelivr (Apache 2.0), SVG→PNG→native fallback",
    "Memory record v2 adds memoryType (M0-M6), ring, emotional, relationships, embedding, temporalDecay",
    "Precog card v2 adds ring, computeTier, targetAgent, safetyGate fields"
  ],
  "open_items": [
    "Wire BlobEmoji component into LanternView.tsx (replace emojiPalette array)",
    "Integrate token_ledger.py into local agent loop (mercer_local_agent.ps1)",
    "Integrate compute_router.py into MCP gateway routing layer",
    "Cartographer GPU engine — HIGHEST PRIORITY, needs local hardware (Ben/Opus)",
    "Rust MCP gateway — Phase 1 backend (Opus/Ben)",
    "Tauri v2 shell around web UI + gateway"
  ],
  "context_files": [
    "memory/session_log_2026-02-11_manus.md",
    "docs/agent_handoff_payload.schema.json",
    "scripts/token_ledger.py",
    "scripts/compute_router.py",
    "web/src/blobmoji.ts",
    "web/src/BlobEmoji.tsx",
    "docs/memory_record.schema.json",
    "docs/precog_card.schema.json"
  ],
  "alignment_score": 97.0,
  "ring_state": {
    "R0": "invariants hold",
    "R1": "stable",
    "R2": "stable",
    "R3": "stable",
    "R4": "updated (memory_record v2 schema)",
    "R5": "updated (precog_card v2 schema)",
    "R6": "major work (handoff payload schema, compute router)",
    "R7": "stable (safety gates added to precog)",
    "R8": "verified (all scripts tested)",
    "R9": "committed (session log, handoff, 7 new files)",
    "R10": "reflected (session summary complete)",
    "R11": "pending integration (next agent wires into Lantern + gateway)"
  }
}
