{
    "handoff_id": "HO-YYYYMMDD-NNN",
    "from_agent": "MANUS_MERCER",
    "to_agent": "CHATGPT_MERCER",
    "timestamp": "YYYY-MM-DDTHH:MM:SSZ",
    "scope": "private",
    "summary": "Completed [summary of work].",
    "decisions_made": [
        "[Decision 1]",
        "[Decision 2]"
    ],
    "open_items": [
        "[Open item or question for next agent]"
    ],
    "context_files": [
        "memory/m0_episodic/session_log_YYYY-MM-DD.md",
        "memory/m3_intentional/working_set.md"
    ],
    "alignment_score": 100.0,
    "ring_state": {
        "R0": "stable",
        "R1": "updated",
        "R2": "synced",
        "R3": "no_predictions_pending",
        "R4": "major_changes",
        "R5": "all_gates_passed",
        "R6": "verified",
        "R7": "committed",
        "R8": "verified",
        "R9": "committed",
        "R10": "reflected",
        "R11": "integrated"
    }
}
